No.     Time        Source                Destination           Protocol Length Info
      1 0.000000    192.168.1.102         128.119.245.12        TCP      62     1161→80 [SYN] Seq=0 Win=16384 Len=0 MSS=1460 SACK_PERM=1

Frame 1: 62 bytes on wire (496 bits), 62 bytes captured (496 bits)
Ethernet II, Src: Actionte_8a:70:1a (00:20:e0:8a:70:1a), Dst: LinksysG_da:af:73 (00:06:25:da:af:73)
    Destination: LinksysG_da:af:73 (00:06:25:da:af:73)
    Source: Actionte_8a:70:1a (00:20:e0:8a:70:1a)
    Type: IP (0x0800)
Internet Protocol Version 4, Src: 192.168.1.102 (192.168.1.102), Dst: 128.119.245.12 (128.119.245.12)
Transmission Control Protocol, Src Port: 1161 (1161), Dst Port: 80 (80), Seq: 0, Len: 0
    Source Port: 1161 (1161)
    Destination Port: 80 (80)
    [Stream index: 0]
    [TCP Segment Len: 0]
    Sequence number: 0    (relative sequence number)
    Acknowledgment number: 0
    Header Length: 28 bytes
    .... 0000 0000 0010 = Flags: 0x002 (SYN)
    Window size value: 16384
    [Calculated window size: 16384]
    Checksum: 0xf6e9 [validation disabled]
    Urgent pointer: 0
    Options: (8 bytes), Maximum segment size, No-Operation (NOP), No-Operation (NOP), SACK permitted

No.     Time        Source                Destination           Protocol Length Info
      2 0.023172    128.119.245.12        192.168.1.102         TCP      62     80→1161 [SYN, ACK] Seq=0 Ack=1 Win=5840 Len=0 MSS=1460 SACK_PERM=1

Frame 2: 62 bytes on wire (496 bits), 62 bytes captured (496 bits)
Ethernet II, Src: LinksysG_da:af:73 (00:06:25:da:af:73), Dst: Actionte_8a:70:1a (00:20:e0:8a:70:1a)
    Destination: Actionte_8a:70:1a (00:20:e0:8a:70:1a)
    Source: LinksysG_da:af:73 (00:06:25:da:af:73)
    Type: IP (0x0800)
Internet Protocol Version 4, Src: 128.119.245.12 (128.119.245.12), Dst: 192.168.1.102 (192.168.1.102)
Transmission Control Protocol, Src Port: 80 (80), Dst Port: 1161 (1161), Seq: 0, Ack: 1, Len: 0
    Source Port: 80 (80)
    Destination Port: 1161 (1161)
    [Stream index: 0]
    [TCP Segment Len: 0]
    Sequence number: 0    (relative sequence number)
    Acknowledgment number: 1    (relative ack number)
    Header Length: 28 bytes
    .... 0000 0001 0010 = Flags: 0x012 (SYN, ACK)
    Window size value: 5840
    [Calculated window size: 5840]
    Checksum: 0x774d [validation disabled]
    Urgent pointer: 0
    Options: (8 bytes), Maximum segment size, No-Operation (NOP), No-Operation (NOP), SACK permitted
    [SEQ/ACK analysis]

No.     Time        Source                Destination           Protocol Length Info
      3 0.023265    192.168.1.102         128.119.245.12        TCP      54     1161→80 [ACK] Seq=1 Ack=1 Win=17520 Len=0

Frame 3: 54 bytes on wire (432 bits), 54 bytes captured (432 bits)
Ethernet II, Src: Actionte_8a:70:1a (00:20:e0:8a:70:1a), Dst: LinksysG_da:af:73 (00:06:25:da:af:73)
    Destination: LinksysG_da:af:73 (00:06:25:da:af:73)
    Source: Actionte_8a:70:1a (00:20:e0:8a:70:1a)
    Type: IP (0x0800)
Internet Protocol Version 4, Src: 192.168.1.102 (192.168.1.102), Dst: 128.119.245.12 (128.119.245.12)
Transmission Control Protocol, Src Port: 1161 (1161), Dst Port: 80 (80), Seq: 1, Ack: 1, Len: 0
    Source Port: 1161 (1161)
    Destination Port: 80 (80)
    [Stream index: 0]
    [TCP Segment Len: 0]
    Sequence number: 1    (relative sequence number)
    Acknowledgment number: 1    (relative ack number)
    Header Length: 20 bytes
    .... 0000 0001 0000 = Flags: 0x010 (ACK)
    Window size value: 17520
    [Calculated window size: 17520]
    [Window size scaling factor: -2 (no window scaling used)]
    Checksum: 0x7671 [validation disabled]
    Urgent pointer: 0
    [SEQ/ACK analysis]

No.     Time        Source                Destination           Protocol Length Info
      4 0.026477    192.168.1.102         128.119.245.12        TCP      619    [TCP segment of a reassembled PDU]

Frame 4: 619 bytes on wire (4952 bits), 619 bytes captured (4952 bits)
Ethernet II, Src: Actionte_8a:70:1a (00:20:e0:8a:70:1a), Dst: LinksysG_da:af:73 (00:06:25:da:af:73)
    Destination: LinksysG_da:af:73 (00:06:25:da:af:73)
    Source: Actionte_8a:70:1a (00:20:e0:8a:70:1a)
    Type: IP (0x0800)
Internet Protocol Version 4, Src: 192.168.1.102 (192.168.1.102), Dst: 128.119.245.12 (128.119.245.12)
Transmission Control Protocol, Src Port: 1161 (1161), Dst Port: 80 (80), Seq: 1, Ack: 1, Len: 565
    Source Port: 1161 (1161)
    Destination Port: 80 (80)
    [Stream index: 0]
    [TCP Segment Len: 565]
    Sequence number: 1    (relative sequence number)
    [Next sequence number: 566    (relative sequence number)]
    Acknowledgment number: 1    (relative ack number)
    Header Length: 20 bytes
    .... 0000 0001 1000 = Flags: 0x018 (PSH, ACK)
    Window size value: 17520
    [Calculated window size: 17520]
    [Window size scaling factor: -2 (no window scaling used)]
    Checksum: 0x1fbd [validation disabled]
    Urgent pointer: 0
    [SEQ/ACK analysis]
    TCP segment data (565 bytes)

No.     Time        Source                Destination           Protocol Length Info
      5 0.041737    192.168.1.102         128.119.245.12        TCP      1514   [TCP segment of a reassembled PDU]

Frame 5: 1514 bytes on wire (12112 bits), 1514 bytes captured (12112 bits)
Ethernet II, Src: Actionte_8a:70:1a (00:20:e0:8a:70:1a), Dst: LinksysG_da:af:73 (00:06:25:da:af:73)
    Destination: LinksysG_da:af:73 (00:06:25:da:af:73)
    Source: Actionte_8a:70:1a (00:20:e0:8a:70:1a)
    Type: IP (0x0800)
Internet Protocol Version 4, Src: 192.168.1.102 (192.168.1.102), Dst: 128.119.245.12 (128.119.245.12)
Transmission Control Protocol, Src Port: 1161 (1161), Dst Port: 80 (80), Seq: 566, Ack: 1, Len: 1460
    Source Port: 1161 (1161)
    Destination Port: 80 (80)
    [Stream index: 0]
    [TCP Segment Len: 1460]
    Sequence number: 566    (relative sequence number)
    [Next sequence number: 2026    (relative sequence number)]
    Acknowledgment number: 1    (relative ack number)
    Header Length: 20 bytes
    .... 0000 0001 1000 = Flags: 0x018 (PSH, ACK)
    Window size value: 17520
    [Calculated window size: 17520]
    [Window size scaling factor: -2 (no window scaling used)]
    Checksum: 0x3be5 [validation disabled]
    Urgent pointer: 0
    [SEQ/ACK analysis]
    [Reassembled PDU in frame: 199]
    TCP segment data (1460 bytes)

No.     Time        Source                Destination           Protocol Length Info
      6 0.053937    128.119.245.12        192.168.1.102         TCP      60     80→1161 [ACK] Seq=1 Ack=566 Win=6780 Len=0

Frame 6: 60 bytes on wire (480 bits), 60 bytes captured (480 bits)
Ethernet II, Src: LinksysG_da:af:73 (00:06:25:da:af:73), Dst: Actionte_8a:70:1a (00:20:e0:8a:70:1a)
    Destination: Actionte_8a:70:1a (00:20:e0:8a:70:1a)
    Source: LinksysG_da:af:73 (00:06:25:da:af:73)
    Type: IP (0x0800)
    Padding: da12000047a5
Internet Protocol Version 4, Src: 128.119.245.12 (128.119.245.12), Dst: 192.168.1.102 (192.168.1.102)
Transmission Control Protocol, Src Port: 80 (80), Dst Port: 1161 (1161), Seq: 1, Ack: 566, Len: 0
    Source Port: 80 (80)
    Destination Port: 1161 (1161)
    [Stream index: 0]
    [TCP Segment Len: 0]
    Sequence number: 1    (relative sequence number)
    Acknowledgment number: 566    (relative ack number)
    Header Length: 20 bytes
    .... 0000 0001 0000 = Flags: 0x010 (ACK)
    Window size value: 6780
    [Calculated window size: 6780]
    [Window size scaling factor: -2 (no window scaling used)]
    Checksum: 0x9e30 [validation disabled]
    Urgent pointer: 0
    [SEQ/ACK analysis]

No.     Time        Source                Destination           Protocol Length Info
      7 0.054026    192.168.1.102         128.119.245.12        TCP      1514   [TCP segment of a reassembled PDU]

Frame 7: 1514 bytes on wire (12112 bits), 1514 bytes captured (12112 bits)
Ethernet II, Src: Actionte_8a:70:1a (00:20:e0:8a:70:1a), Dst: LinksysG_da:af:73 (00:06:25:da:af:73)
    Destination: LinksysG_da:af:73 (00:06:25:da:af:73)
    Source: Actionte_8a:70:1a (00:20:e0:8a:70:1a)
    Type: IP (0x0800)
Internet Protocol Version 4, Src: 192.168.1.102 (192.168.1.102), Dst: 128.119.245.12 (128.119.245.12)
Transmission Control Protocol, Src Port: 1161 (1161), Dst Port: 80 (80), Seq: 2026, Ack: 1, Len: 1460
    Source Port: 1161 (1161)
    Destination Port: 80 (80)
    [Stream index: 0]
    [TCP Segment Len: 1460]
    Sequence number: 2026    (relative sequence number)
    [Next sequence number: 3486    (relative sequence number)]
    Acknowledgment number: 1    (relative ack number)
    Header Length: 20 bytes
    .... 0000 0001 0000 = Flags: 0x010 (ACK)
    Window size value: 17520
    [Calculated window size: 17520]
    [Window size scaling factor: -2 (no window scaling used)]
    Checksum: 0xb98e [validation disabled]
    Urgent pointer: 0
    [SEQ/ACK analysis]
    [Reassembled PDU in frame: 199]
    TCP segment data (1460 bytes)

No.     Time        Source                Destination           Protocol Length Info
      8 0.054690    192.168.1.102         128.119.245.12        TCP      1514   [TCP segment of a reassembled PDU]

Frame 8: 1514 bytes on wire (12112 bits), 1514 bytes captured (12112 bits)
Ethernet II, Src: Actionte_8a:70:1a (00:20:e0:8a:70:1a), Dst: LinksysG_da:af:73 (00:06:25:da:af:73)
    Destination: LinksysG_da:af:73 (00:06:25:da:af:73)
    Source: Actionte_8a:70:1a (00:20:e0:8a:70:1a)
    Type: IP (0x0800)
Internet Protocol Version 4, Src: 192.168.1.102 (192.168.1.102), Dst: 128.119.245.12 (128.119.245.12)
Transmission Control Protocol, Src Port: 1161 (1161), Dst Port: 80 (80), Seq: 3486, Ack: 1, Len: 1460
    Source Port: 1161 (1161)
    Destination Port: 80 (80)
    [Stream index: 0]
    [TCP Segment Len: 1460]
    Sequence number: 3486    (relative sequence number)
    [Next sequence number: 4946    (relative sequence number)]
    Acknowledgment number: 1    (relative ack number)
    Header Length: 20 bytes
    .... 0000 0001 0000 = Flags: 0x010 (ACK)
    Window size value: 17520
    [Calculated window size: 17520]
    [Window size scaling factor: -2 (no window scaling used)]
    Checksum: 0xdd01 [validation disabled]
    Urgent pointer: 0
    [SEQ/ACK analysis]
    [Reassembled PDU in frame: 199]
    TCP segment data (1460 bytes)

No.     Time        Source                Destination           Protocol Length Info
      9 0.077294    128.119.245.12        192.168.1.102         TCP      60     80→1161 [ACK] Seq=1 Ack=2026 Win=8760 Len=0

Frame 9: 60 bytes on wire (480 bits), 60 bytes captured (480 bits)
Ethernet II, Src: LinksysG_da:af:73 (00:06:25:da:af:73), Dst: Actionte_8a:70:1a (00:20:e0:8a:70:1a)
    Destination: Actionte_8a:70:1a (00:20:e0:8a:70:1a)
    Source: LinksysG_da:af:73 (00:06:25:da:af:73)
    Type: IP (0x0800)
    Padding: 879e00003a30
Internet Protocol Version 4, Src: 128.119.245.12 (128.119.245.12), Dst: 192.168.1.102 (192.168.1.102)
Transmission Control Protocol, Src Port: 80 (80), Dst Port: 1161 (1161), Seq: 1, Ack: 2026, Len: 0
    Source Port: 80 (80)
    Destination Port: 1161 (1161)
    [Stream index: 0]
    [TCP Segment Len: 0]
    Sequence number: 1    (relative sequence number)
    Acknowledgment number: 2026    (relative ack number)
    Header Length: 20 bytes
    .... 0000 0001 0000 = Flags: 0x010 (ACK)
    Window size value: 8760
    [Calculated window size: 8760]
    [Window size scaling factor: -2 (no window scaling used)]
    Checksum: 0x90c0 [validation disabled]
    Urgent pointer: 0
    [SEQ/ACK analysis]

No.     Time        Source                Destination           Protocol Length Info
     10 0.077405    192.168.1.102         128.119.245.12        TCP      1514   [TCP segment of a reassembled PDU]

Frame 10: 1514 bytes on wire (12112 bits), 1514 bytes captured (12112 bits)
Ethernet II, Src: Actionte_8a:70:1a (00:20:e0:8a:70:1a), Dst: LinksysG_da:af:73 (00:06:25:da:af:73)
    Destination: LinksysG_da:af:73 (00:06:25:da:af:73)
    Source: Actionte_8a:70:1a (00:20:e0:8a:70:1a)
    Type: IP (0x0800)
Internet Protocol Version 4, Src: 192.168.1.102 (192.168.1.102), Dst: 128.119.245.12 (128.119.245.12)
Transmission Control Protocol, Src Port: 1161 (1161), Dst Port: 80 (80), Seq: 4946, Ack: 1, Len: 1460
    Source Port: 1161 (1161)
    Destination Port: 80 (80)
    [Stream index: 0]
    [TCP Segment Len: 1460]
    Sequence number: 4946    (relative sequence number)
    [Next sequence number: 6406    (relative sequence number)]
    Acknowledgment number: 1    (relative ack number)
    Header Length: 20 bytes
    .... 0000 0001 0000 = Flags: 0x010 (ACK)
    Window size value: 17520
    [Calculated window size: 17520]
    [Window size scaling factor: -2 (no window scaling used)]
    Checksum: 0x908e [validation disabled]
    Urgent pointer: 0
    [SEQ/ACK analysis]
    [Reassembled PDU in frame: 199]
    TCP segment data (1460 bytes)

No.     Time        Source                Destination           Protocol Length Info
     11 0.078157    192.168.1.102         128.119.245.12        TCP      1514   [TCP segment of a reassembled PDU]

Frame 11: 1514 bytes on wire (12112 bits), 1514 bytes captured (12112 bits)
Ethernet II, Src: Actionte_8a:70:1a (00:20:e0:8a:70:1a), Dst: LinksysG_da:af:73 (00:06:25:da:af:73)
    Destination: LinksysG_da:af:73 (00:06:25:da:af:73)
    Source: Actionte_8a:70:1a (00:20:e0:8a:70:1a)
    Type: IP (0x0800)
Internet Protocol Version 4, Src: 192.168.1.102 (192.168.1.102), Dst: 128.119.245.12 (128.119.245.12)
Transmission Control Protocol, Src Port: 1161 (1161), Dst Port: 80 (80), Seq: 6406, Ack: 1, Len: 1460
    Source Port: 1161 (1161)
    Destination Port: 80 (80)
    [Stream index: 0]
    [TCP Segment Len: 1460]
    Sequence number: 6406    (relative sequence number)
    [Next sequence number: 7866    (relative sequence number)]
    Acknowledgment number: 1    (relative ack number)
    Header Length: 20 bytes
    .... 0000 0001 0000 = Flags: 0x010 (ACK)
    Window size value: 17520
    [Calculated window size: 17520]
    [Window size scaling factor: -2 (no window scaling used)]
    Checksum: 0x9583 [validation disabled]
    Urgent pointer: 0
    [SEQ/ACK analysis]
    [Reassembled PDU in frame: 199]
    TCP segment data (1460 bytes)

No.     Time        Source                Destination           Protocol Length Info
     12 0.124085    128.119.245.12        192.168.1.102         TCP      60     80→1161 [ACK] Seq=1 Ack=3486 Win=11680 Len=0

Frame 12: 60 bytes on wire (480 bits), 60 bytes captured (480 bits)
Ethernet II, Src: LinksysG_da:af:73 (00:06:25:da:af:73), Dst: Actionte_8a:70:1a (00:20:e0:8a:70:1a)
    Destination: Actionte_8a:70:1a (00:20:e0:8a:70:1a)
    Source: LinksysG_da:af:73 (00:06:25:da:af:73)
    Type: IP (0x0800)
    Padding: 7bec00005f33
Internet Protocol Version 4, Src: 128.119.245.12 (128.119.245.12), Dst: 192.168.1.102 (192.168.1.102)
Transmission Control Protocol, Src Port: 80 (80), Dst Port: 1161 (1161), Seq: 1, Ack: 3486, Len: 0
    Source Port: 80 (80)
    Destination Port: 1161 (1161)
    [Stream index: 0]
    [TCP Segment Len: 0]
    Sequence number: 1    (relative sequence number)
    Acknowledgment number: 3486    (relative ack number)
    Header Length: 20 bytes
    .... 0000 0001 0000 = Flags: 0x010 (ACK)
    Window size value: 11680
    [Calculated window size: 11680]
    [Window size scaling factor: -2 (no window scaling used)]
    Checksum: 0x7fa4 [validation disabled]
    Urgent pointer: 0
    [SEQ/ACK analysis]

No.     Time        Source                Destination           Protocol Length Info
     13 0.124185    192.168.1.102         128.119.245.12        TCP      1201   [TCP segment of a reassembled PDU]

Frame 13: 1201 bytes on wire (9608 bits), 1201 bytes captured (9608 bits)
Ethernet II, Src: Actionte_8a:70:1a (00:20:e0:8a:70:1a), Dst: LinksysG_da:af:73 (00:06:25:da:af:73)
    Destination: LinksysG_da:af:73 (00:06:25:da:af:73)
    Source: Actionte_8a:70:1a (00:20:e0:8a:70:1a)
    Type: IP (0x0800)
Internet Protocol Version 4, Src: 192.168.1.102 (192.168.1.102), Dst: 128.119.245.12 (128.119.245.12)
Transmission Control Protocol, Src Port: 1161 (1161), Dst Port: 80 (80), Seq: 7866, Ack: 1, Len: 1147
    Source Port: 1161 (1161)
    Destination Port: 80 (80)
    [Stream index: 0]
    [TCP Segment Len: 1147]
    Sequence number: 7866    (relative sequence number)
    [Next sequence number: 9013    (relative sequence number)]
    Acknowledgment number: 1    (relative ack number)
    Header Length: 20 bytes
    .... 0000 0001 1000 = Flags: 0x018 (PSH, ACK)
    Window size value: 17520
    [Calculated window size: 17520]
    [Window size scaling factor: -2 (no window scaling used)]
    Checksum: 0xd763 [validation disabled]
    Urgent pointer: 0
    [SEQ/ACK analysis]
    [Reassembled PDU in frame: 199]
    TCP segment data (1147 bytes)

No.     Time        Source                Destination           Protocol Length Info
     14 0.169118    128.119.245.12        192.168.1.102         TCP      60     80→1161 [ACK] Seq=1 Ack=4946 Win=14600 Len=0

Frame 14: 60 bytes on wire (480 bits), 60 bytes captured (480 bits)
Ethernet II, Src: LinksysG_da:af:73 (00:06:25:da:af:73), Dst: Actionte_8a:70:1a (00:20:e0:8a:70:1a)
    Destination: Actionte_8a:70:1a (00:20:e0:8a:70:1a)
    Source: LinksysG_da:af:73 (00:06:25:da:af:73)
    Type: IP (0x0800)
    Padding: d43c0000d83a
Internet Protocol Version 4, Src: 128.119.245.12 (128.119.245.12), Dst: 192.168.1.102 (192.168.1.102)
Transmission Control Protocol, Src Port: 80 (80), Dst Port: 1161 (1161), Seq: 1, Ack: 4946, Len: 0
    Source Port: 80 (80)
    Destination Port: 1161 (1161)
    [Stream index: 0]
    [TCP Segment Len: 0]
    Sequence number: 1    (relative sequence number)
    Acknowledgment number: 4946    (relative ack number)
    Header Length: 20 bytes
    .... 0000 0001 0000 = Flags: 0x010 (ACK)
    Window size value: 14600
    [Calculated window size: 14600]
    [Window size scaling factor: -2 (no window scaling used)]
    Checksum: 0x6e88 [validation disabled]
    Urgent pointer: 0
    [SEQ/ACK analysis]

No.     Time        Source                Destination           Protocol Length Info
     15 0.217299    128.119.245.12        192.168.1.102         TCP      60     80→1161 [ACK] Seq=1 Ack=6406 Win=17520 Len=0

Frame 15: 60 bytes on wire (480 bits), 60 bytes captured (480 bits)
Ethernet II, Src: LinksysG_da:af:73 (00:06:25:da:af:73), Dst: Actionte_8a:70:1a (00:20:e0:8a:70:1a)
    Destination: Actionte_8a:70:1a (00:20:e0:8a:70:1a)
    Source: LinksysG_da:af:73 (00:06:25:da:af:73)
    Type: IP (0x0800)
    Padding: 6af30000b520
Internet Protocol Version 4, Src: 128.119.245.12 (128.119.245.12), Dst: 192.168.1.102 (192.168.1.102)
Transmission Control Protocol, Src Port: 80 (80), Dst Port: 1161 (1161), Seq: 1, Ack: 6406, Len: 0
    Source Port: 80 (80)
    Destination Port: 1161 (1161)
    [Stream index: 0]
    [TCP Segment Len: 0]
    Sequence number: 1    (relative sequence number)
    Acknowledgment number: 6406    (relative ack number)
    Header Length: 20 bytes
    .... 0000 0001 0000 = Flags: 0x010 (ACK)
    Window size value: 17520
    [Calculated window size: 17520]
    [Window size scaling factor: -2 (no window scaling used)]
    Checksum: 0x5d6c [validation disabled]
    Urgent pointer: 0
    [SEQ/ACK analysis]

No.     Time        Source                Destination           Protocol Length Info
     16 0.267802    128.119.245.12        192.168.1.102         TCP      60     80→1161 [ACK] Seq=1 Ack=7866 Win=20440 Len=0

Frame 16: 60 bytes on wire (480 bits), 60 bytes captured (480 bits)
Ethernet II, Src: LinksysG_da:af:73 (00:06:25:da:af:73), Dst: Actionte_8a:70:1a (00:20:e0:8a:70:1a)
    Destination: Actionte_8a:70:1a (00:20:e0:8a:70:1a)
    Source: LinksysG_da:af:73 (00:06:25:da:af:73)
    Type: IP (0x0800)
    Padding: 93c0000063ed
Internet Protocol Version 4, Src: 128.119.245.12 (128.119.245.12), Dst: 192.168.1.102 (192.168.1.102)
Transmission Control Protocol, Src Port: 80 (80), Dst Port: 1161 (1161), Seq: 1, Ack: 7866, Len: 0
    Source Port: 80 (80)
    Destination Port: 1161 (1161)
    [Stream index: 0]
    [TCP Segment Len: 0]
    Sequence number: 1    (relative sequence number)
    Acknowledgment number: 7866    (relative ack number)
    Header Length: 20 bytes
    .... 0000 0001 0000 = Flags: 0x010 (ACK)
    Window size value: 20440
    [Calculated window size: 20440]
    [Window size scaling factor: -2 (no window scaling used)]
    Checksum: 0x4c50 [validation disabled]
    Urgent pointer: 0
    [SEQ/ACK analysis]

No.     Time        Source                Destination           Protocol Length Info
     17 0.304807    128.119.245.12        192.168.1.102         TCP      60     80→1161 [ACK] Seq=1 Ack=9013 Win=23360 Len=0

Frame 17: 60 bytes on wire (480 bits), 60 bytes captured (480 bits)
Ethernet II, Src: LinksysG_da:af:73 (00:06:25:da:af:73), Dst: Actionte_8a:70:1a (00:20:e0:8a:70:1a)
    Destination: Actionte_8a:70:1a (00:20:e0:8a:70:1a)
    Source: LinksysG_da:af:73 (00:06:25:da:af:73)
    Type: IP (0x0800)
    Padding: eadd0000aa2a
Internet Protocol Version 4, Src: 128.119.245.12 (128.119.245.12), Dst: 192.168.1.102 (192.168.1.102)
Transmission Control Protocol, Src Port: 80 (80), Dst Port: 1161 (1161), Seq: 1, Ack: 9013, Len: 0
    Source Port: 80 (80)
    Destination Port: 1161 (1161)
    [Stream index: 0]
    [TCP Segment Len: 0]
    Sequence number: 1    (relative sequence number)
    Acknowledgment number: 9013    (relative ack number)
    Header Length: 20 bytes
    .... 0000 0001 0000 = Flags: 0x010 (ACK)
    Window size value: 23360
    [Calculated window size: 23360]
    [Window size scaling factor: -2 (no window scaling used)]
    Checksum: 0x3c6d [validation disabled]
    Urgent pointer: 0
    [SEQ/ACK analysis]

No.     Time        Source                Destination           Protocol Length Info
     18 0.305040    192.168.1.102         128.119.245.12        TCP      1514   [TCP segment of a reassembled PDU]

Frame 18: 1514 bytes on wire (12112 bits), 1514 bytes captured (12112 bits)
Ethernet II, Src: Actionte_8a:70:1a (00:20:e0:8a:70:1a), Dst: LinksysG_da:af:73 (00:06:25:da:af:73)
    Destination: LinksysG_da:af:73 (00:06:25:da:af:73)
    Source: Actionte_8a:70:1a (00:20:e0:8a:70:1a)
    Type: IP (0x0800)
Internet Protocol Version 4, Src: 192.168.1.102 (192.168.1.102), Dst: 128.119.245.12 (128.119.245.12)
Transmission Control Protocol, Src Port: 1161 (1161), Dst Port: 80 (80), Seq: 9013, Ack: 1, Len: 1460
    Source Port: 1161 (1161)
    Destination Port: 80 (80)
    [Stream index: 0]
    [TCP Segment Len: 1460]
    Sequence number: 9013    (relative sequence number)
    [Next sequence number: 10473    (relative sequence number)]
    Acknowledgment number: 1    (relative ack number)
    Header Length: 20 bytes
    .... 0000 0001 0000 = Flags: 0x010 (ACK)
    Window size value: 17520
    [Calculated window size: 17520]
    [Window size scaling factor: -2 (no window scaling used)]
    Checksum: 0xe628 [validation disabled]
    Urgent pointer: 0
    [SEQ/ACK analysis]
    [Reassembled PDU in frame: 199]
    TCP segment data (1460 bytes)

No.     Time        Source                Destination           Protocol Length Info
     19 0.305813    192.168.1.102         128.119.245.12        TCP      1514   [TCP segment of a reassembled PDU]

Frame 19: 1514 bytes on wire (12112 bits), 1514 bytes captured (12112 bits)
Ethernet II, Src: Actionte_8a:70:1a (00:20:e0:8a:70:1a), Dst: LinksysG_da:af:73 (00:06:25:da:af:73)
    Destination: LinksysG_da:af:73 (00:06:25:da:af:73)
    Source: Actionte_8a:70:1a (00:20:e0:8a:70:1a)
    Type: IP (0x0800)
Internet Protocol Version 4, Src: 192.168.1.102 (192.168.1.102), Dst: 128.119.245.12 (128.119.245.12)
Transmission Control Protocol, Src Port: 1161 (1161), Dst Port: 80 (80), Seq: 10473, Ack: 1, Len: 1460
    Source Port: 1161 (1161)
    Destination Port: 80 (80)
    [Stream index: 0]
    [TCP Segment Len: 1460]
    Sequence number: 10473    (relative sequence number)
    [Next sequence number: 11933    (relative sequence number)]
    Acknowledgment number: 1    (relative ack number)
    Header Length: 20 bytes
    .... 0000 0001 0000 = Flags: 0x010 (ACK)
    Window size value: 17520
    [Calculated window size: 17520]
    [Window size scaling factor: -2 (no window scaling used)]
    Checksum: 0x4e31 [validation disabled]
    Urgent pointer: 0
    [SEQ/ACK analysis]
    [Reassembled PDU in frame: 199]
    TCP segment data (1460 bytes)

No.     Time        Source                Destination           Protocol Length Info
     20 0.306692    192.168.1.102         128.119.245.12        TCP      1514   [TCP segment of a reassembled PDU]

Frame 20: 1514 bytes on wire (12112 bits), 1514 bytes captured (12112 bits)
Ethernet II, Src: Actionte_8a:70:1a (00:20:e0:8a:70:1a), Dst: LinksysG_da:af:73 (00:06:25:da:af:73)
    Destination: LinksysG_da:af:73 (00:06:25:da:af:73)
    Source: Actionte_8a:70:1a (00:20:e0:8a:70:1a)
    Type: IP (0x0800)
Internet Protocol Version 4, Src: 192.168.1.102 (192.168.1.102), Dst: 128.119.245.12 (128.119.245.12)
Transmission Control Protocol, Src Port: 1161 (1161), Dst Port: 80 (80), Seq: 11933, Ack: 1, Len: 1460
    Source Port: 1161 (1161)
    Destination Port: 80 (80)
    [Stream index: 0]
    [TCP Segment Len: 1460]
    Sequence number: 11933    (relative sequence number)
    [Next sequence number: 13393    (relative sequence number)]
    Acknowledgment number: 1    (relative ack number)
    Header Length: 20 bytes
    .... 0000 0001 0000 = Flags: 0x010 (ACK)
    Window size value: 17520
    [Calculated window size: 17520]
    [Window size scaling factor: -2 (no window scaling used)]
    Checksum: 0xed39 [validation disabled]
    Urgent pointer: 0
    [SEQ/ACK analysis]
    [Reassembled PDU in frame: 199]
    TCP segment data (1460 bytes)

No.     Time        Source                Destination           Protocol Length Info
     21 0.307571    192.168.1.102         128.119.245.12        TCP      1514   [TCP segment of a reassembled PDU]

Frame 21: 1514 bytes on wire (12112 bits), 1514 bytes captured (12112 bits)
Ethernet II, Src: Actionte_8a:70:1a (00:20:e0:8a:70:1a), Dst: LinksysG_da:af:73 (00:06:25:da:af:73)
    Destination: LinksysG_da:af:73 (00:06:25:da:af:73)
    Source: Actionte_8a:70:1a (00:20:e0:8a:70:1a)
    Type: IP (0x0800)
Internet Protocol Version 4, Src: 192.168.1.102 (192.168.1.102), Dst: 128.119.245.12 (128.119.245.12)
Transmission Control Protocol, Src Port: 1161 (1161), Dst Port: 80 (80), Seq: 13393, Ack: 1, Len: 1460
    Source Port: 1161 (1161)
    Destination Port: 80 (80)
    [Stream index: 0]
    [TCP Segment Len: 1460]
    Sequence number: 13393    (relative sequence number)
    [Next sequence number: 14853    (relative sequence number)]
    Acknowledgment number: 1    (relative ack number)
    Header Length: 20 bytes
    .... 0000 0001 0000 = Flags: 0x010 (ACK)
    Window size value: 17520
    [Calculated window size: 17520]
    [Window size scaling factor: -2 (no window scaling used)]
    Checksum: 0x9467 [validation disabled]
    Urgent pointer: 0
    [SEQ/ACK analysis]
    [Reassembled PDU in frame: 199]
    TCP segment data (1460 bytes)

No.     Time        Source                Destination           Protocol Length Info
     22 0.308699    192.168.1.102         128.119.245.12        TCP      1514   [TCP segment of a reassembled PDU]

Frame 22: 1514 bytes on wire (12112 bits), 1514 bytes captured (12112 bits)
Ethernet II, Src: Actionte_8a:70:1a (00:20:e0:8a:70:1a), Dst: LinksysG_da:af:73 (00:06:25:da:af:73)
    Destination: LinksysG_da:af:73 (00:06:25:da:af:73)
    Source: Actionte_8a:70:1a (00:20:e0:8a:70:1a)
    Type: IP (0x0800)
Internet Protocol Version 4, Src: 192.168.1.102 (192.168.1.102), Dst: 128.119.245.12 (128.119.245.12)
Transmission Control Protocol, Src Port: 1161 (1161), Dst Port: 80 (80), Seq: 14853, Ack: 1, Len: 1460
    Source Port: 1161 (1161)
    Destination Port: 80 (80)
    [Stream index: 0]
    [TCP Segment Len: 1460]
    Sequence number: 14853    (relative sequence number)
    [Next sequence number: 16313    (relative sequence number)]
    Acknowledgment number: 1    (relative ack number)
    Header Length: 20 bytes
    .... 0000 0001 0000 = Flags: 0x010 (ACK)
    Window size value: 17520
    [Calculated window size: 17520]
    [Window size scaling factor: -2 (no window scaling used)]
    Checksum: 0x4963 [validation disabled]
    Urgent pointer: 0
    [SEQ/ACK analysis]
    [Reassembled PDU in frame: 199]
    TCP segment data (1460 bytes)

No.     Time        Source                Destination           Protocol Length Info
     23 0.309553    192.168.1.102         128.119.245.12        TCP      946    [TCP segment of a reassembled PDU]

Frame 23: 946 bytes on wire (7568 bits), 946 bytes captured (7568 bits)
Ethernet II, Src: Actionte_8a:70:1a (00:20:e0:8a:70:1a), Dst: LinksysG_da:af:73 (00:06:25:da:af:73)
    Destination: LinksysG_da:af:73 (00:06:25:da:af:73)
    Source: Actionte_8a:70:1a (00:20:e0:8a:70:1a)
    Type: IP (0x0800)
Internet Protocol Version 4, Src: 192.168.1.102 (192.168.1.102), Dst: 128.119.245.12 (128.119.245.12)
Transmission Control Protocol, Src Port: 1161 (1161), Dst Port: 80 (80), Seq: 16313, Ack: 1, Len: 892
    Source Port: 1161 (1161)
    Destination Port: 80 (80)
    [Stream index: 0]
    [TCP Segment Len: 892]
    Sequence number: 16313    (relative sequence number)
    [Next sequence number: 17205    (relative sequence number)]
    Acknowledgment number: 1    (relative ack number)
    Header Length: 20 bytes
    .... 0000 0001 1000 = Flags: 0x018 (PSH, ACK)
    Window size value: 17520
    [Calculated window size: 17520]
    [Window size scaling factor: -2 (no window scaling used)]
    Checksum: 0x4d0a [validation disabled]
    Urgent pointer: 0
    [SEQ/ACK analysis]
    [Reassembled PDU in frame: 199]
    TCP segment data (892 bytes)

No.     Time        Source                Destination           Protocol Length Info
     24 0.356437    128.119.245.12        192.168.1.102         TCP      60     80→1161 [ACK] Seq=1 Ack=10473 Win=26280 Len=0

Frame 24: 60 bytes on wire (480 bits), 60 bytes captured (480 bits)
Ethernet II, Src: LinksysG_da:af:73 (00:06:25:da:af:73), Dst: Actionte_8a:70:1a (00:20:e0:8a:70:1a)
    Destination: Actionte_8a:70:1a (00:20:e0:8a:70:1a)
    Source: LinksysG_da:af:73 (00:06:25:da:af:73)
    Type: IP (0x0800)
    Padding: 268f00007372
Internet Protocol Version 4, Src: 128.119.245.12 (128.119.245.12), Dst: 192.168.1.102 (192.168.1.102)
Transmission Control Protocol, Src Port: 80 (80), Dst Port: 1161 (1161), Seq: 1, Ack: 10473, Len: 0
    Source Port: 80 (80)
    Destination Port: 1161 (1161)
    [Stream index: 0]
    [TCP Segment Len: 0]
    Sequence number: 1    (relative sequence number)
    Acknowledgment number: 10473    (relative ack number)
    Header Length: 20 bytes
    .... 0000 0001 0000 = Flags: 0x010 (ACK)
    Window size value: 26280
    [Calculated window size: 26280]
    [Window size scaling factor: -2 (no window scaling used)]
    Checksum: 0x2b51 [validation disabled]
    Urgent pointer: 0
    [SEQ/ACK analysis]

No.     Time        Source                Destination           Protocol Length Info
     25 0.400164    128.119.245.12        192.168.1.102         TCP      60     80→1161 [ACK] Seq=1 Ack=11933 Win=29200 Len=0

Frame 25: 60 bytes on wire (480 bits), 60 bytes captured (480 bits)
Ethernet II, Src: LinksysG_da:af:73 (00:06:25:da:af:73), Dst: Actionte_8a:70:1a (00:20:e0:8a:70:1a)
    Destination: Actionte_8a:70:1a (00:20:e0:8a:70:1a)
    Source: LinksysG_da:af:73 (00:06:25:da:af:73)
    Type: IP (0x0800)
    Padding: 478600005cc9
Internet Protocol Version 4, Src: 128.119.245.12 (128.119.245.12), Dst: 192.168.1.102 (192.168.1.102)
Transmission Control Protocol, Src Port: 80 (80), Dst Port: 1161 (1161), Seq: 1, Ack: 11933, Len: 0
    Source Port: 80 (80)
    Destination Port: 1161 (1161)
    [Stream index: 0]
    [TCP Segment Len: 0]
    Sequence number: 1    (relative sequence number)
    Acknowledgment number: 11933    (relative ack number)
    Header Length: 20 bytes
    .... 0000 0001 0000 = Flags: 0x010 (ACK)
    Window size value: 29200
    [Calculated window size: 29200]
    [Window size scaling factor: -2 (no window scaling used)]
    Checksum: 0x1a35 [validation disabled]
    Urgent pointer: 0
    [SEQ/ACK analysis]

No.     Time        Source                Destination           Protocol Length Info
     26 0.448613    128.119.245.12        192.168.1.102         TCP      60     80→1161 [ACK] Seq=1 Ack=13393 Win=32120 Len=0

Frame 26: 60 bytes on wire (480 bits), 60 bytes captured (480 bits)
Ethernet II, Src: LinksysG_da:af:73 (00:06:25:da:af:73), Dst: Actionte_8a:70:1a (00:20:e0:8a:70:1a)
    Destination: Actionte_8a:70:1a (00:20:e0:8a:70:1a)
    Source: LinksysG_da:af:73 (00:06:25:da:af:73)
    Type: IP (0x0800)
    Padding: 4e3400003d19
Internet Protocol Version 4, Src: 128.119.245.12 (128.119.245.12), Dst: 192.168.1.102 (192.168.1.102)
Transmission Control Protocol, Src Port: 80 (80), Dst Port: 1161 (1161), Seq: 1, Ack: 13393, Len: 0
    Source Port: 80 (80)
    Destination Port: 1161 (1161)
    [Stream index: 0]
    [TCP Segment Len: 0]
    Sequence number: 1    (relative sequence number)
    Acknowledgment number: 13393    (relative ack number)
    Header Length: 20 bytes
    .... 0000 0001 0000 = Flags: 0x010 (ACK)
    Window size value: 32120
    [Calculated window size: 32120]
    [Window size scaling factor: -2 (no window scaling used)]
    Checksum: 0x0919 [validation disabled]
    Urgent pointer: 0
    [SEQ/ACK analysis]

No.     Time        Source                Destination           Protocol Length Info
     27 0.500029    128.119.245.12        192.168.1.102         TCP      60     80→1161 [ACK] Seq=1 Ack=14853 Win=35040 Len=0

Frame 27: 60 bytes on wire (480 bits), 60 bytes captured (480 bits)
Ethernet II, Src: LinksysG_da:af:73 (00:06:25:da:af:73), Dst: Actionte_8a:70:1a (00:20:e0:8a:70:1a)
    Destination: Actionte_8a:70:1a (00:20:e0:8a:70:1a)
    Source: LinksysG_da:af:73 (00:06:25:da:af:73)
    Type: IP (0x0800)
    Padding: 11b70000c56e
Internet Protocol Version 4, Src: 128.119.245.12 (128.119.245.12), Dst: 192.168.1.102 (192.168.1.102)
Transmission Control Protocol, Src Port: 80 (80), Dst Port: 1161 (1161), Seq: 1, Ack: 14853, Len: 0
    Source Port: 80 (80)
    Destination Port: 1161 (1161)
    [Stream index: 0]
    [TCP Segment Len: 0]
    Sequence number: 1    (relative sequence number)
    Acknowledgment number: 14853    (relative ack number)
    Header Length: 20 bytes
    .... 0000 0001 0000 = Flags: 0x010 (ACK)
    Window size value: 35040
    [Calculated window size: 35040]
    [Window size scaling factor: -2 (no window scaling used)]
    Checksum: 0xf7fc [validation disabled]
    Urgent pointer: 0
    [SEQ/ACK analysis]

No.     Time        Source                Destination           Protocol Length Info
     28 0.545052    128.119.245.12        192.168.1.102         TCP      60     80→1161 [ACK] Seq=1 Ack=16313 Win=37960 Len=0

Frame 28: 60 bytes on wire (480 bits), 60 bytes captured (480 bits)
Ethernet II, Src: LinksysG_da:af:73 (00:06:25:da:af:73), Dst: Actionte_8a:70:1a (00:20:e0:8a:70:1a)
    Destination: Actionte_8a:70:1a (00:20:e0:8a:70:1a)
    Source: LinksysG_da:af:73 (00:06:25:da:af:73)
    Type: IP (0x0800)
    Padding: 51330000073e
Internet Protocol Version 4, Src: 128.119.245.12 (128.119.245.12), Dst: 192.168.1.102 (192.168.1.102)
Transmission Control Protocol, Src Port: 80 (80), Dst Port: 1161 (1161), Seq: 1, Ack: 16313, Len: 0
    Source Port: 80 (80)
    Destination Port: 1161 (1161)
    [Stream index: 0]
    [TCP Segment Len: 0]
    Sequence number: 1    (relative sequence number)
    Acknowledgment number: 16313    (relative ack number)
    Header Length: 20 bytes
    .... 0000 0001 0000 = Flags: 0x010 (ACK)
    Window size value: 37960
    [Calculated window size: 37960]
    [Window size scaling factor: -2 (no window scaling used)]
    Checksum: 0xe6e0 [validation disabled]
    Urgent pointer: 0
    [SEQ/ACK analysis]

No.     Time        Source                Destination           Protocol Length Info
     29 0.576417    128.119.245.12        192.168.1.102         TCP      60     80→1161 [ACK] Seq=1 Ack=17205 Win=37960 Len=0

Frame 29: 60 bytes on wire (480 bits), 60 bytes captured (480 bits)
Ethernet II, Src: LinksysG_da:af:73 (00:06:25:da:af:73), Dst: Actionte_8a:70:1a (00:20:e0:8a:70:1a)
    Destination: Actionte_8a:70:1a (00:20:e0:8a:70:1a)
    Source: LinksysG_da:af:73 (00:06:25:da:af:73)
    Type: IP (0x0800)
    Padding: c5dc0000950e
Internet Protocol Version 4, Src: 128.119.245.12 (128.119.245.12), Dst: 192.168.1.102 (192.168.1.102)
Transmission Control Protocol, Src Port: 80 (80), Dst Port: 1161 (1161), Seq: 1, Ack: 17205, Len: 0
    Source Port: 80 (80)
    Destination Port: 1161 (1161)
    [Stream index: 0]
    [TCP Segment Len: 0]
    Sequence number: 1    (relative sequence number)
    Acknowledgment number: 17205    (relative ack number)
    Header Length: 20 bytes
    .... 0000 0001 0000 = Flags: 0x010 (ACK)
    Window size value: 37960
    [Calculated window size: 37960]
    [Window size scaling factor: -2 (no window scaling used)]
    Checksum: 0xe364 [validation disabled]
    Urgent pointer: 0
    [SEQ/ACK analysis]

No.     Time        Source                Destination           Protocol Length Info
     30 0.576671    192.168.1.102         128.119.245.12        TCP      1514   [TCP segment of a reassembled PDU]

Frame 30: 1514 bytes on wire (12112 bits), 1514 bytes captured (12112 bits)
Ethernet II, Src: Actionte_8a:70:1a (00:20:e0:8a:70:1a), Dst: LinksysG_da:af:73 (00:06:25:da:af:73)
    Destination: LinksysG_da:af:73 (00:06:25:da:af:73)
    Source: Actionte_8a:70:1a (00:20:e0:8a:70:1a)
    Type: IP (0x0800)
Internet Protocol Version 4, Src: 192.168.1.102 (192.168.1.102), Dst: 128.119.245.12 (128.119.245.12)
Transmission Control Protocol, Src Port: 1161 (1161), Dst Port: 80 (80), Seq: 17205, Ack: 1, Len: 1460
    Source Port: 1161 (1161)
    Destination Port: 80 (80)
    [Stream index: 0]
    [TCP Segment Len: 1460]
    Sequence number: 17205    (relative sequence number)
    [Next sequence number: 18665    (relative sequence number)]
    Acknowledgment number: 1    (relative ack number)
    Header Length: 20 bytes
    .... 0000 0001 0000 = Flags: 0x010 (ACK)
    Window size value: 17520
    [Calculated window size: 17520]
    [Window size scaling factor: -2 (no window scaling used)]
    Checksum: 0x17db [validation disabled]
    Urgent pointer: 0
    [SEQ/ACK analysis]
    [Reassembled PDU in frame: 199]
    TCP segment data (1460 bytes)

No.     Time        Source                Destination           Protocol Length Info
     31 0.577385    192.168.1.102         128.119.245.12        TCP      1514   [TCP segment of a reassembled PDU]

Frame 31: 1514 bytes on wire (12112 bits), 1514 bytes captured (12112 bits)
Ethernet II, Src: Actionte_8a:70:1a (00:20:e0:8a:70:1a), Dst: LinksysG_da:af:73 (00:06:25:da:af:73)
    Destination: LinksysG_da:af:73 (00:06:25:da:af:73)
    Source: Actionte_8a:70:1a (00:20:e0:8a:70:1a)
    Type: IP (0x0800)
Internet Protocol Version 4, Src: 192.168.1.102 (192.168.1.102), Dst: 128.119.245.12 (128.119.245.12)
Transmission Control Protocol, Src Port: 1161 (1161), Dst Port: 80 (80), Seq: 18665, Ack: 1, Len: 1460
    Source Port: 1161 (1161)
    Destination Port: 80 (80)
    [Stream index: 0]
    [TCP Segment Len: 1460]
    Sequence number: 18665    (relative sequence number)
    [Next sequence number: 20125    (relative sequence number)]
    Acknowledgment number: 1    (relative ack number)
    Header Length: 20 bytes
    .... 0000 0001 0000 = Flags: 0x010 (ACK)
    Window size value: 17520
    [Calculated window size: 17520]
    [Window size scaling factor: -2 (no window scaling used)]
    Checksum: 0x91a4 [validation disabled]
    Urgent pointer: 0
    [SEQ/ACK analysis]
    [Reassembled PDU in frame: 199]
    TCP segment data (1460 bytes)

